,text,place,uri,collector,area,lat,lon,english
78038,Εκυλίεν το κουτίν κι' εύρεν το πώμαν άθες,"Πόντος, Χαλδία",http://hdl.handle.net/20.500.11853/153662,"Μελίδης, Θεόδωρος",Πόντος,40.0850088,23.9775837,The dog turned around and found the bone in its own yard.
59702,Η πρώτη μου γυναίκα δούλα κι΄ η δεύτερη κυρά,Εύβοια,http://hdl.handle.net/20.500.11853/179122,"Κυριαζόπουλος, Σπυρίδων Δ.",Εύβοια,38.49417235,23.91108439913793,The first wife is a servant and the second a mistress
74204,Απελπισμένο κάτεργο βαθειά νερά αρμενίζει,Ήπειρος,http://hdl.handle.net/20.500.11853/153039,"Μανούσος, Αντώνιος",Ήπειρος,37.9982534,23.7378671,A desperate man will clutch at a straw.
110736,Το αβγό ψήνεται,Ανατολική Θράκη,http://hdl.handle.net/20.500.11853/189289,"Σταμούλη – Σαραντή, Ελπινίκη",Ανατολική Θράκη,41.6759327,26.5587225,The egg is boiling.
32212,"Να δίνης εκεινών οπού πεινάνε, όχι εκείνων οπύ χορεύουνε!",Επτάνησος,http://hdl.handle.net/20.500.11853/174596,"Καββαδίας, Γεώργιος",Επτάνησος,38.8351105,20.7094392,"Give to those who are hungry, not to those who are dancing!"
75736,Εσύ γριά που (δ)ιακονείς αλεύριν έχεις και πουλείς;,Κάρπαθος,http://hdl.handle.net/20.500.11853/169701,"Μανωλακάκης, Εμμανουήλ",Κάρπαθος,35.6136611,27.11925668821135,You old woman who serves flour do you have any and sell some?
78788,Ημαθ' η γρηά στα σύκα,"Μικρά Ασία, Βουρλά",http://hdl.handle.net/20.500.11853/196031,"Μηλιώρης, Νίκος Ε.",Μικρά Ασία,38.1846366,23.5122768,An old woman learned to dance on figs
66447,"Κόρφος που μπάση, θα βάλη",Κεφαλληνία,http://hdl.handle.net/20.500.11853/187991,"Λουκάτος, Δημήτριος Σ.",Κεφαλληνία,38.2379344,20.560883,A tree that bends will break.
83706,Εγώ προστάζω την κάταν μου κι' η κάτα τα κατουδια της,Λακωνία,http://hdl.handle.net/20.500.11853/261343,"Νεστορίδης, Κ.",Λακωνία,36.76027945,22.79046431389755,"I command my wife, and she commands the servants"
